{
  "schema_version": "1.0",
  "brand_id": "calapres",
  "source": "shopify_order_event",
  "operation": "upsert",
  "source_event_fingerprint": "4444444444444444444444444444444444444444444444444444444444444444",
  "idempotency_fingerprint": "5555555555555555555555555555555555555555555555555555555555555555",
  "record": {
    "schema_version": "1.0",
    "brand_id": "calapres",
    "shopify_order_gid": "gid://shopify/Order/100000001",
    "shopify_customer_gid": "gid://shopify/Customer/200000001",
    "order_name_fingerprint": "6666666666666666666666666666666666666666666666666666666666666666",
    "email_fingerprint": "7777777777777777777777777777777777777777777777777777777777777777",
    "buyer_phone_fingerprint": "8888888888888888888888888888888888888888888888888888888888888888",
    "recipient_phone_fingerprint": null,
    "fingerprint_key_version": "hmac-sha256-v1",
    "status_class": "active",
    "order_created_at": "2026-08-11T12:00:00+03:00",
    "order_updated_at": "2026-08-11T12:05:00+03:00",
    "indexed_at": "2026-08-11T12:05:01+03:00",
    "expires_at": "2026-11-09T12:05:01+03:00"
  }
}
